{
  "version": "1.0.0",
  "schemaVersion": "1-0-1",
  "name": "Defer, Scheduled, Out-of-Cycle, Immediate",
  "description": "The original SSVC outcome group.",
  "outcomes": [
    {
      "key": "D",
      "name": "Defer",
      "description": "Defer"
    },
    {
      "key": "S",
      "name": "Scheduled",
      "description": "Scheduled"
    },
    {
      "key": "O",
      "name": "Out-of-Cycle",
      "description": "Out-of-Cycle"
    },
    {
      "key": "I",
      "name": "Immediate",
      "description": "Immediate"
    }
  ]
}