{
  "version": "1.0.0",
  "schemaVersion": "1-0-1",
  "name": "CISA Levels",
  "description": "The CISA outcome group. CISA uses its own SSVC decision tree model to prioritize relevant vulnerabilities into four possible decisions: Track, Track*, Attend, and Act.",
  "outcomes": [
    {
      "key": "T",
      "name": "Track",
      "description": "The vulnerability does not require action at this time. The organization would continue to track the vulnerability and reassess it if new information becomes available. CISA recommends remediating Track vulnerabilities within standard update timelines."
    },
    {
      "key": "T*",
      "name": "Track*",
      "description": "The vulnerability contains specific characteristics that may require closer monitoring for changes. CISA recommends remediating Track* vulnerabilities within standard update timelines."
    },
    {
      "key": "A",
      "name": "Attend",
      "description": "The vulnerability requires attention from the organization's internal, supervisory-level individuals. Necessary actions may include requesting assistance or information about the vulnerability and may involve publishing a notification, either internally and/or externally, about the vulnerability. CISA recommends remediating Attend vulnerabilities sooner than standard update timelines."
    },
    {
      "key": "A",
      "name": "Act",
      "description": "The vulnerability requires attention from the organization's internal, supervisory-level and leadership-level individuals. Necessary actions include requesting assistance or information about the vulnerability, as well as publishing a notification either internally and/or externally. Typically, internal groups would meet to determine the overall response and then execute agreed upon actions. CISA recommends remediating Act vulnerabilities as soon as possible."
    }
  ]
}