{
  "version": "1.0.0",
  "schemaVersion": "1-0-1",
  "name": "Publish, Do Not Publish",
  "description": "The publish outcome group.",
  "outcomes": [
    {
      "key": "N",
      "name": "Do Not Publish",
      "description": "Do Not Publish"
    },
    {
      "key": "P",
      "name": "Publish",
      "description": "Publish"
    }
  ]
}